[
  {
    "name": "Access Advisors",
    "domain": "disability & accessibility tech",
    "what": "Access Advisors is a New Zealand digital accessibility consultancy that helps organisations, including government agencies and banks, test and design websites and services so they work for disabled people, using a panel of disabled testers with real assistive technology.",
    "region": "national",
    "website": "https://accessadvisors.nz",
    "github": "",
    "linkedin_org": "https://www.linkedin.com/company/access-advisors-nz",
    "community_url": "",
    "events_url": "",
    "linkedin_people": [],
    "tags": [
      "accessibility",
      "disability",
      "consulting",
      "WCAG",
      "assistive technology"
    ],
    "related_to": [
      "Blind Low Vision NZ",
      "Be. Lab"
    ],
    "source": "accessadvisors.nz homepage (verified via WebFetch); linkedin_org verified from accessadvisors.nz footer and linkedin.com (2026-08-25)",
    "founding_year": 2020,
    "takes_contributors": true,
    "careers_url": "",
    "last_verified": "2026-08-05"
  },
  {
    "name": "Access Matters Aotearoa (Access Alliance)",
    "domain": "disability & accessibility tech",
    "what": "Access Matters Aotearoa (originally the Access Alliance, formed in 2017 with support from Blind Low Vision NZ) is a coalition of disabled people's organisations campaigning for an Accessibility Act that would require services and technology across New Zealand to be accessible to disabled people.",
    "region": "national",
    "website": "https://www.accessmatters.org.nz",
    "github": "",
    "linkedin_org": "https://www.linkedin.com/company/access-matters-aotearoa/",
    "community_url": "",
    "events_url": "",
    "linkedin_people": [],
    "tags": [
      "accessibility",
      "disability advocacy",
      "legislation",
      "coalition"
    ],
    "related_to": [
      "Blind Low Vision NZ"
    ],
    "source": "accessmatters.org.nz (verified via WebFetch); founding history from abcnz.org.nz (Blind Citizens NZ) found via web search; linkedin_org, volunteer page and careers_url verified via accessmatters.org.nz (2026-08-25)",
    "founding_year": 2023,
    "takes_contributors": true,
    "careers_url": "https://www.accessmatters.org.nz/volunteer",
    "last_verified": "2026-08-05"
  },
  {
    "name": "ActionStation",
    "domain": "human-rights tech",
    "what": "ActionStation is a New Zealand digital campaigning organisation that helps everyday people run online petitions and coordinated campaigns on issues like Te Tiriti o Waitangi (the Treaty of Waitangi), climate justice, and welfare.",
    "region": "wellington",
    "website": "https://actionstation.org.nz",
    "github": "https://github.com/actionstation",
    "linkedin_org": "https://nz.linkedin.com/company/actionstation",
    "community_url": "",
    "events_url": "",
    "linkedin_people": [],
    "tags": [
      "digital campaigning",
      "advocacy",
      "petitions",
      "Te Tiriti"
    ],
    "related_to": [
      "Amnesty International Aotearoa New Zealand"
    ],
    "source": "actionstation.org.nz (verified via WebFetch); Wikipedia page for co-director Kassie Hartendorp found via web search",
    "founding_year": 2012,
    "takes_contributors": true,
    "careers_url": "",
    "last_verified": "2026-08-05"
  },
  {
    "name": "AI Forum New Zealand",
    "domain": "tech-ethics / responsible-AI",
    "what": "AI Forum New Zealand is a member organisation that brings together businesses, researchers, and government to guide artificial intelligence in New Zealand, running working groups on AI governance and a Māori AI Advisory Panel to help make sure AI is developed responsibly and inclusively.",
    "region": "national",
    "website": "https://aiforum.org.nz",
    "github": "",
    "linkedin_org": "https://www.linkedin.com/company/aiforumnz/",
    "community_url": "",
    "events_url": "",
    "linkedin_people": [],
    "tags": [
      "responsible AI",
      "tech ethics",
      "industry network",
      "AI governance"
    ],
    "related_to": [
      "Te Mana Raraunga"
    ],
    "source": "aiforum.org.nz homepage (verified via WebFetch); linkedin_org verified from aiforum.org.nz footer and linkedin.com (2026-08-25)",
    "founding_year": 2017,
    "takes_contributors": true,
    "careers_url": "",
    "last_verified": "2026-08-05"
  },
  {
    "name": "AI Safety Aotearoa",
    "domain": "tech-ethics / responsible-AI",
    "what": "AI Safety Aotearoa is an independent public education initiative that explains AI risks and safety in plain language for New Zealanders, covering topics like deepfakes, data sovereignty, algorithmic bias and election integrity through explainers, research and community events.",
    "region": "wellington",
    "website": "https://www.aisafetyaotearoa.org",
    "github": "",
    "linkedin_org": "https://www.linkedin.com/company/ai-safety-aotearoa",
    "community_url": "",
    "events_url": "",
    "linkedin_people": [],
    "tags": [
      "AI safety",
      "AI ethics",
      "public education",
      "responsible AI",
      "advocacy"
    ],
    "related_to": [],
    "source": "aisafetyaotearoa.org homepage and get-involved page, verified via WebFetch 2026-08-06; linkedin_org verified via linkedin.com (2026-08-25)",
    "founding_year": 2025,
    "takes_contributors": true,
    "careers_url": "https://www.aisafetyaotearoa.org/get-involved",
    "last_verified": "2026-08-06"
  },
  {
    "name": "ALTER (Advancing Law and Technology Responsibly)",
    "domain": "legal-aid / justice tech",
    "what": "ALTER is a University of Auckland Law School initiative that runs a student hackathon, fellowships, and publications to build technology that improves access to legal and social support in New Zealand, while thinking carefully about the ethics of that technology.",
    "region": "auckland",
    "website": "https://www.alter.auckland.ac.nz/",
    "github": "",
    "linkedin_org": "",
    "community_url": "",
    "events_url": "",
    "linkedin_people": [],
    "tags": [
      "legal tech",
      "hackathon",
      "university",
      "access to justice",
      "responsible tech"
    ],
    "related_to": [
      "OpenLaw NZ"
    ],
    "source": "alter.auckland.ac.nz/hackathon (verified via WebFetch)",
    "founding_year": 2020,
    "takes_contributors": true,
    "careers_url": "",
    "last_verified": "2026-08-05"
  },
  {
    "name": "Amnesty International Aotearoa New Zealand",
    "domain": "human-rights tech",
    "what": "Amnesty International Aotearoa New Zealand is the local chapter of the global human rights movement, established in 1965, that runs online petitions, letter-writing actions, and digital campaigns on issues like refugee rights and climate justice.",
    "region": "auckland",
    "website": "https://amnesty.org.nz",
    "github": "",
    "linkedin_org": "",
    "community_url": "",
    "events_url": "",
    "linkedin_people": [],
    "tags": [
      "human rights",
      "digital campaigning",
      "advocacy",
      "non-profit"
    ],
    "related_to": [
      "ActionStation"
    ],
    "source": "amnesty.org.nz/who-we-are (verified via WebFetch); careers_url verified via amnesty.org.nz/work-with-us (2026-08-25)",
    "founding_year": 1961,
    "takes_contributors": true,
    "careers_url": "https://amnesty.org.nz/work-with-us/",
    "last_verified": "2026-08-05"
  },
  {
    "name": "Amotai",
    "domain": "iwi / Māori tech initiatives",
    "what": "Amotai is Aotearoa's supplier diversity intermediary, connecting public and private sector buyers with over 2,200 verified Māori and Pasifika-owned businesses, including more than 100 tech suppliers working across AI, cybersecurity, automation, and digital services. Founded in 2018 within Auckland Council, it now operates nationally, helping grow Māori and Pasifika business capability and increasing the share of procurement contracts awarded to these communities.",
    "region": "national",
    "website": "https://amotai.nz",
    "github": "",
    "linkedin_org": "https://nz.linkedin.com/company/amotai",
    "community_url": "",
    "events_url": "",
    "linkedin_people": [],
    "tags": [
      "māori-business",
      "pasifika-business",
      "supplier-diversity",
      "procurement",
      "economic-equity",
      "verified-suppliers"
    ],
    "related_to": [],
    "source": "amotai.nz confirmed active via web search; Amotai Supplier Diversity Awards 2025 event confirmed via OurAuckland (August 2025); founding in 2018 at Auckland Council confirmed by multiple sources including The Spinoff and Amotai's own founding story page; verified via web search 2026-08-05",
    "founding_year": 2018,
    "takes_contributors": false,
    "careers_url": "",
    "last_verified": "2026-08-05"
  },
  {
    "name": "Aotearoa Food Rescue Alliance",
    "domain": "food-rescue / food-security tech",
    "what": "The Aotearoa Food Rescue Alliance (AFRA) is the national peak body for food rescue organisations in New Zealand, providing sector coordination, shared data collection through a sector data portal, and advocacy to government on food security policy.",
    "region": "national",
    "website": "https://afra.org.nz",
    "github": "",
    "linkedin_org": "https://nz.linkedin.com/company/aotearoa-food-rescue-alliance",
    "community_url": "",
    "events_url": "",
    "linkedin_people": [],
    "tags": [
      "food rescue",
      "food security",
      "advocacy",
      "data",
      "national"
    ],
    "related_to": [],
    "source": "Web search confirmed via afra.org.nz/about-us/, waiwaste.org.nz/about/aotearoa-food-rescue-alliance/, LinkedIn company page, and Facebook page showing active posts in 2025; direct site fetch blocked by bot protection (403) (verified 2026-08-05)",
    "founding_year": 2021,
    "takes_contributors": true,
    "careers_url": "",
    "last_verified": "2026-08-05"
  },
  {
    "name": "Ara Ake",